{"$schema":"https://json-schema.org/draft/2020-12/schema","type":"object","additionalProperties":false,"required":["analysis_id","search_id","analysis_date","risk_score","risk_level","evidence_quality","applicable_law_version","methodology","risk_factors","counter_evidence","suggestions","citations","uncertainties","model_metadata","disclaimer","created_at"],"properties":{"analysis_id":{"type":"string"},"search_id":{"type":"string"},"analysis_date":{"type":"string"},"risk_score":{"type":"number"},"risk_level":{"enum":["low","medium","high","insufficient_evidence"]},"evidence_quality":{"type":"string"},"applicable_law_version":{"type":"string"},"methodology":{"type":"object"},"risk_factors":{"type":"array"},"counter_evidence":{"type":"array"},"suggestions":{"type":"array"},"citations":{"type":"array"},"uncertainties":{"type":"array"},"model_metadata":{"type":"object"},"disclaimer":{"type":"string"},"created_at":{"type":"string"}}}
