{"analysis_id":"risk_demo","search_id":"search_demo","analysis_date":"2026-07-13","risk_score":0.88,"risk_level":"high","evidence_quality":"demo_only","applicable_law_version":"2019年修正现行商标法","methodology":{"score_owner":"deterministic_engine"},"risk_factors":[{"title":"文字近似"}],"counter_evidence":[],"suggestions":["修改主要识别部分"],"citations":[],"uncertainties":["仅使用演示数据"],"model_metadata":{"score_was_model_generated":false},"disclaimer":"不构成法律意见。","created_at":"2026-07-13T12:00:02"}
